{
  "schema_version": "1.0.0",
  "artefact": "tab.guitar",
  "analysis_id": "0192f6c4-8b00-7a00-8000-0000000000aa",
  "notes_ref": {
    "artefact": "notes.guitar",
    "artefact_version": 1
  },
  "beats_ref": {
    "artefact_version": 1,
    "corrections_rev": 0
  },
  "ppq": 960,
  "tuning_midi": [64, 59, 55, 50, 45, 40],
  "capo": 0,
  "level": "as_transcribed",
  "fingering_mode": "easiest",
  "events": [
    {
      "note_id": "n000000",
      "bar": 0,
      "beat": 1,
      "tick": 0,
      "duration_ticks": 960,
      "quantize_residual_ms": 4.0,
      "string": 5,
      "fret": 0
    },
    {
      "note_id": "n000001",
      "bar": 0,
      "beat": 2,
      "tick": 0,
      "duration_ticks": 960,
      "quantize_residual_ms": -6.0,
      "string": 4,
      "fret": 2,
      "alt_fingerings": [
        {
          "string": 5,
          "fret": 7,
          "cost": 2.5
        }
      ]
    },
    {
      "note_id": "n000002",
      "bar": 0,
      "beat": 3,
      "tick": 0,
      "duration_ticks": 960,
      "quantize_residual_ms": 9.0,
      "string": 3,
      "fret": 2,
      "alt_fingerings": [
        {
          "string": 4,
          "fret": 7,
          "cost": 2.5
        }
      ]
    },
    {
      "note_id": "n000003",
      "bar": 0,
      "beat": 4,
      "tick": 0,
      "duration_ticks": 960,
      "quantize_residual_ms": -2.0,
      "string": 2,
      "fret": 1
    },
    {
      "note_id": "n000004",
      "bar": 1,
      "beat": 1,
      "tick": 0,
      "duration_ticks": 960,
      "quantize_residual_ms": 7.0,
      "string": 5,
      "fret": 0
    },
    {
      "note_id": "n000005",
      "bar": 1,
      "beat": 2,
      "tick": 0,
      "duration_ticks": 960,
      "quantize_residual_ms": -11.0,
      "string": 4,
      "fret": 2,
      "alt_fingerings": [
        {
          "string": 5,
          "fret": 7,
          "cost": 2.5
        }
      ]
    },
    {
      "note_id": "n000006",
      "bar": 1,
      "beat": 3,
      "tick": 0,
      "duration_ticks": 960,
      "quantize_residual_ms": 3.0,
      "string": 3,
      "fret": 2,
      "alt_fingerings": [
        {
          "string": 4,
          "fret": 7,
          "cost": 2.5
        }
      ]
    },
    {
      "note_id": "n000007",
      "bar": 1,
      "beat": 4,
      "tick": 0,
      "duration_ticks": 960,
      "quantize_residual_ms": 5.0,
      "string": 2,
      "fret": 1
    },
    {
      "note_id": "n000008",
      "bar": 2,
      "beat": 1,
      "tick": 0,
      "duration_ticks": 960,
      "quantize_residual_ms": -4.0,
      "string": 6,
      "fret": 1
    },
    {
      "note_id": "n000009",
      "bar": 2,
      "beat": 2,
      "tick": 0,
      "duration_ticks": 960,
      "quantize_residual_ms": 8.0,
      "string": 5,
      "fret": 3
    },
    {
      "note_id": "n000010",
      "bar": 2,
      "beat": 3,
      "tick": 0,
      "duration_ticks": 960,
      "quantize_residual_ms": -7.0,
      "string": 4,
      "fret": 3
    },
    {
      "note_id": "n000011",
      "bar": 2,
      "beat": 4,
      "tick": 0,
      "duration_ticks": 960,
      "quantize_residual_ms": 2.0,
      "string": 3,
      "fret": 2,
      "alt_fingerings": [
        {
          "string": 4,
          "fret": 7,
          "cost": 2.5
        }
      ]
    },
    {
      "note_id": "n000012",
      "bar": 3,
      "beat": 1,
      "tick": 0,
      "duration_ticks": 960,
      "quantize_residual_ms": 12.0,
      "string": 6,
      "fret": 1
    },
    {
      "note_id": "n000013",
      "bar": 3,
      "beat": 2,
      "tick": 0,
      "duration_ticks": 960,
      "quantize_residual_ms": -3.0,
      "string": 5,
      "fret": 3
    },
    {
      "note_id": "n000014",
      "bar": 3,
      "beat": 3,
      "tick": 0,
      "duration_ticks": 960,
      "quantize_residual_ms": 6.0,
      "string": 4,
      "fret": 3
    },
    {
      "note_id": "n000015",
      "bar": 3,
      "beat": 4,
      "tick": 0,
      "duration_ticks": 960,
      "quantize_residual_ms": -9.0,
      "string": 3,
      "fret": 2,
      "alt_fingerings": [
        {
          "string": 4,
          "fret": 7,
          "cost": 2.5
        }
      ]
    },
    {
      "note_id": "n000016",
      "bar": 4,
      "beat": 1,
      "tick": 0,
      "duration_ticks": 960,
      "quantize_residual_ms": 4.0,
      "string": 5,
      "fret": 3
    },
    {
      "note_id": "n000017",
      "bar": 4,
      "beat": 2,
      "tick": 0,
      "duration_ticks": 960,
      "quantize_residual_ms": -6.0,
      "string": 4,
      "fret": 2,
      "alt_fingerings": [
        {
          "string": 5,
          "fret": 7,
          "cost": 2.5
        }
      ]
    },
    {
      "note_id": "n000018",
      "bar": 4,
      "beat": 3,
      "tick": 0,
      "duration_ticks": 960,
      "quantize_residual_ms": 9.0,
      "string": 3,
      "fret": 0,
      "alt_fingerings": [
        {
          "string": 4,
          "fret": 5,
          "cost": 1.5
        }
      ]
    },
    {
      "note_id": "n000019",
      "bar": 4,
      "beat": 4,
      "tick": 0,
      "duration_ticks": 960,
      "quantize_residual_ms": -2.0,
      "string": 2,
      "fret": 1
    },
    {
      "note_id": "n000020",
      "bar": 5,
      "beat": 1,
      "tick": 0,
      "duration_ticks": 960,
      "quantize_residual_ms": 7.0,
      "string": 5,
      "fret": 3
    },
    {
      "note_id": "n000021",
      "bar": 5,
      "beat": 2,
      "tick": 0,
      "duration_ticks": 960,
      "quantize_residual_ms": -11.0,
      "string": 4,
      "fret": 2,
      "alt_fingerings": [
        {
          "string": 5,
          "fret": 7,
          "cost": 2.5
        }
      ]
    },
    {
      "note_id": "n000022",
      "bar": 5,
      "beat": 3,
      "tick": 0,
      "duration_ticks": 960,
      "quantize_residual_ms": 3.0,
      "string": 3,
      "fret": 0,
      "alt_fingerings": [
        {
          "string": 4,
          "fret": 5,
          "cost": 1.5
        }
      ]
    },
    {
      "note_id": "n000023",
      "bar": 5,
      "beat": 4,
      "tick": 0,
      "duration_ticks": 960,
      "quantize_residual_ms": 5.0,
      "string": 2,
      "fret": 1
    },
    {
      "note_id": "n000024",
      "bar": 6,
      "beat": 1,
      "tick": 0,
      "duration_ticks": 960,
      "quantize_residual_ms": -4.0,
      "string": 6,
      "fret": 3
    },
    {
      "note_id": "n000025",
      "bar": 6,
      "beat": 2,
      "tick": 0,
      "duration_ticks": 960,
      "quantize_residual_ms": 8.0,
      "string": 4,
      "fret": 0
    },
    {
      "note_id": "n000026",
      "bar": 6,
      "beat": 3,
      "tick": 0,
      "duration_ticks": 960,
      "quantize_residual_ms": -7.0,
      "string": 3,
      "fret": 0,
      "alt_fingerings": [
        {
          "string": 4,
          "fret": 5,
          "cost": 1.5
        }
      ]
    },
    {
      "note_id": "n000027",
      "bar": 6,
      "beat": 4,
      "tick": 0,
      "duration_ticks": 960,
      "quantize_residual_ms": 2.0,
      "string": 2,
      "fret": 0,
      "alt_fingerings": [
        {
          "string": 3,
          "fret": 4,
          "cost": 1.5
        }
      ]
    },
    {
      "note_id": "n000028",
      "bar": 7,
      "beat": 1,
      "tick": 0,
      "duration_ticks": 960,
      "quantize_residual_ms": 12.0,
      "string": 6,
      "fret": 3
    },
    {
      "note_id": "n000029",
      "bar": 7,
      "beat": 2,
      "tick": 0,
      "duration_ticks": 960,
      "quantize_residual_ms": -3.0,
      "string": 4,
      "fret": 0
    },
    {
      "note_id": "n000030",
      "bar": 7,
      "beat": 3,
      "tick": 0,
      "duration_ticks": 960,
      "quantize_residual_ms": 6.0,
      "string": 3,
      "fret": 0,
      "alt_fingerings": [
        {
          "string": 4,
          "fret": 5,
          "cost": 1.5
        }
      ]
    },
    {
      "note_id": "n000031",
      "bar": 7,
      "beat": 4,
      "tick": 0,
      "duration_ticks": 1920,
      "quantize_residual_ms": -9.0,
      "string": 2,
      "fret": 0,
      "alt_fingerings": [
        {
          "string": 3,
          "fret": 4,
          "cost": 1.5
        }
      ]
    }
  ],
  "music_core_version": "0.0.0"
}
